{"$schema":"https://json-schema.org/draft/2020-12/schema","title":"EV4 Generated Asset","type":"object","required":["schema","target_widget","asset_role","compatibility_profile","validation_result","svg_profile"],"properties":{"schema":{"const":"ev4-generated-asset@1.0.0"},"target_widget":{"type":"string"},"asset_role":{"type":"string"},"compatibility_profile":{"enum":["elementor_safe_svg_simple","browser_only","unverified"]},"validation_result":{"enum":["approved","blocked","needs_evidence"]},"browser_rendered":{"type":"boolean"},"elementor_compatibility_evidence":{"type":"array"},"svg_profile":{"type":"object","properties":{"uses_filter":{"type":"boolean"},"uses_gradient":{"type":"boolean"},"uses_complex_defs_or_masks":{"type":"boolean"},"uses_simple_primitives":{"type":"boolean"},"stroke_fill_elementor_safe":{"type":"boolean"},"justification":{"type":"string"}},"required":["uses_filter","uses_gradient","uses_complex_defs_or_masks","uses_simple_primitives","stroke_fill_elementor_safe"],"additionalProperties":false}},"additionalProperties":false}
