{"schema":"ev4-generated-asset@1.0.0","target_widget":"html","asset_role":"decorative_connector","compatibility_profile":"elementor_safe_svg_simple","validation_result":"approved","browser_rendered":true,"elementor_compatibility_evidence":["safe_svg_profile"],"svg_profile":{"uses_filter":false,"uses_gradient":false,"uses_complex_defs_or_masks":false,"uses_simple_primitives":true,"stroke_fill_elementor_safe":true}}
